{"$schema": "https://json-schema.org/draft/2020-12/schema","additionalProperties": false,"properties": {"claimBoundary": {"type": "string"},"compactSummary": {"additionalProperties": false,"properties": {"cadence": {"type": "string"},"descriptiveEarlierCadence": {"type": "string"},"equalityContract": {"type": "string"}},"required": ["cadence", "equalityContract", "descriptiveEarlierCadence"],"type": "object"},"estimation": {"additionalProperties": false,"properties": {"bootstrap": {"additionalProperties": false,"properties": {"method": {"type": "string"},"resamples": {"const": 10000},"role": {"type": "string"}},"required": ["resamples", "method", "role"],"type": "object"},"cohorts": {"const": ["A", "B"]},"controlContrasts": {"additionalProperties": false,"properties": {"alpha": {"type": "string"},"contrasts": {"items": {"type": "string"},"maxItems": 4,"minItems": 4,"type": "array"}},"required": ["contrasts", "alpha"],"type": "object"},"estimationOnly": {"const": true},"interpretationRules": {"additionalProperties": false,"properties": {"notEstablished": {"type": "string"},"positivePreliminary": {"type": "string"},"practicallyPositive": {"type": "string"}},"required": ["positivePreliminary", "practicallyPositive", "notEstablished"],"type": "object"},"intervals": {"additionalProperties": false,"properties": {"method": {"type": "string"},"primaryCoverage": {"type": "string"},"report": {"items": {"type": "string"},"type": "array"}},"required": ["method", "primaryCoverage", "report"],"type": "object"},"primaryStatistic": {"type": "string"},"prohibited": {"items": {"type": "string"},"minItems": 5,"type": "array"},"samplingAssumptions": {"type": "string"},"secondaryDescriptives": {"type": "string"},"unit": {"type": "string"},"zeroVarianceRule": {"type": "string"}},"required": ["unit", "primaryStatistic", "cohorts", "intervals", "bootstrap", "controlContrasts", "interpretationRules", "zeroVarianceRule", "samplingAssumptions", "estimationOnly", "prohibited", "secondaryDescriptives"],"type": "object"},"fidelity": {"additionalProperties": false,"properties": {"ledgerMessageContrast": {"type": "string"},"measure": {"type": "string"},"note": {"type": "string"}},"required": ["measure", "ledgerMessageContrast", "note"],"type": "object"},"independentReduction": {"additionalProperties": false,"properties": {"environment": {"type": "string"},"forbidden": {"items": {"type": "string"},"minItems": 3,"type": "array"},"implementation": {"type": "string"},"recomputes": {"items": {"type": "string"},"minItems": 6,"type": "array"},"tolerances": {"additionalProperties": false,"properties": {"derivedScoresAndIntervals": {"const": 1e-8},"exactFields": {"items": {"type": "string"},"type": "array"},"probabilities": {"const": 1e-10}},"required": ["probabilities", "derivedScoresAndIntervals", "exactFields"],"type": "object"}},"required": ["implementation", "recomputes", "tolerances", "environment", "forbidden"],"type": "object"},"invaliditySensitivity": {"type": "string"},"nativePredictor": {"additionalProperties": false,"properties": {"forbidden": {"items": {"type": "string"},"minItems": 5,"type": "array"},"informationNote": {"type": "string"},"missingToken": {"type": "string"},"selection": {"type": "string"},"source": {"type": "string"},"value": {"type": "string"}},"required": ["source", "selection", "value", "missingToken", "forbidden", "informationNote"],"type": "object"},"ordinaryRecordWindow": {"additionalProperties": false,"properties": {"deliveryFactScope": {"type": "string"},"deliveredTokenInventoryRef": {"type": "string"},"emptyFoldRule": {"type": "string"},"forbidden": {"items": {"type": "string"},"minItems": 6,"type": "array"},"majorityReconciliation": {"type": "string"},"refit": {"type": "string"},"selection": {"type": "string"},"trainingCasesPerReceiverRole": {"const": 1500},"validationFitCasesPerReceiverRole": {"const": 120},"validationSelectionCasesPerReceiverRole": {"const": 120}},"required": ["trainingCasesPerReceiverRole", "validationFitCasesPerReceiverRole", "validationSelectionCasesPerReceiverRole", "selection", "refit", "majorityReconciliation", "forbidden", "deliveryFactScope", "deliveredTokenInventoryRef", "emptyFoldRule"],"type": "object"},"overheadBenchmark": {"additionalProperties": false,"properties": {"capCpuHours": {"const": 0.1},"counts": {"type": "string"},"forbidden": {"items": {"type": "string"},"minItems": 3,"type": "array"},"keys": {"type": "string"},"measure": {"type": "string"},"paths": {"type": "string"},"trackedIn": {"type": "string"}},"required": ["counts", "paths", "keys", "capCpuHours", "measure", "trackedIn", "forbidden"],"type": "object"},"predictionTarget": {"const": "receiver actual selected candidate position"},"predictors": {"items": {"additionalProperties": false,"properties": {"coefficientCount": {"type": "number"},"features": {"type": "string"},"fit": {"type": "string"},"id": {"type": "string"},"role": {"type": "string"},"selectionEligible": {"type": "boolean"}},"required": ["id", "role", "selectionEligible", "fit"],"type": "object"},"maxItems": 10,"minItems": 10,"type": "array"},"researchFinding": {"const": false},"scientificDisposition": {"const": "not-tested"},"score": {"additionalProperties": false,"properties": {"expectedExcessReplayFormula": {"type": "string"},"formula": {"type": "string"},"name": {"const": "multiclass-brier/v1"}},"required": ["name", "formula", "expectedExcessReplayFormula"],"type": "object"},"status": {"const": "frozen"},"studyId": {"const": "ALA-LV"},"studyProtocol": {"const": "protocols/ala-lv-study.v1.json"}},"required": ["studyId", "status", "researchFinding", "scientificDisposition", "predictionTarget", "nativePredictor", "predictors", "ordinaryRecordWindow", "score", "estimation", "invaliditySensitivity", "compactSummary", "fidelity", "overheadBenchmark", "independentReduction", "studyProtocol", "claimBoundary"],"title": "ALA-LV analysis contract v1","type": "object"}