{"claimBoundary": "This is a fixed estimation-only analysis contract, not a result, power claim, or finding. No LV01 family supported label or 90% power claim may be output for ALA cohorts.","compactSummary": {"cadence": "latest association for every token/receiver taken every 64 training cases and at the final training cutoff, scored with the identical native formula","descriptiveEarlierCadence": "Any earlier-cadence readout is separately declared descriptive and labels its staleness.","equalityContract": "The final full-content summary and the equal-content unsigned control must predict identically to the corresponding native readout (deterministic sufficiency/integrity check). History supports provenance audit; it is not credited with extra predictive information over its identical sufficient summary."},"estimation": {"bootstrap": {"method": "deterministic whole-dyad resampling; resampling seed frozen in the execution manifest","resamples": 10000,"role": "sensitivity analysis; never select the more favorable interval"},"cohorts": ["A", "B"],"controlContrasts": {"alpha": "0.05/8 simultaneous one-sided lower bounds over the eight control contrasts (four per cohort: normal-minus-disabled/constant/random/shuffled), dyad-clustered","contrasts": ["normal-minus-disabled", "normal-minus-constant", "normal-minus-random", "normal-minus-shuffled"]},"estimationOnly": true,"intervals": {"method": "two-sided Student-t intervals across dyads","primaryCoverage": "97.5% individual intervals for the two primary cohort intervals (Bonferroni 95% joint coverage)","report": ["N", "SD", "SE", "method", "resampling seed"]},"interpretationRules": {"notEstablished": "Failure to meet a rule is 'not established', never proof of no effect.","positivePreliminary": "Positive primary lower bounds in BOTH cohorts AND positive normal-minus-control bounds.","practicallyPositive": "Both primary bounds above 0.02 (inherited prospective reference, not measured utility)."},"primaryStatistic": "per-dyad equal average over the two receiver roles of mean selected-ordinary Brier minus native Brier on normal-branch test cases; positive favors native","prohibited": ["LV01 family supported labels", "90% power claims", "retrospective powered-equivalence", "post-hoc observed power", "retrospective alpha changes"],"samplingAssumptions": "Dyads are the independent sampling units; across-dyad t-intervals assume approximate normality of dyad means; flag small-N sensitivity explicitly.","secondaryDescriptives": "Other marginal descriptive intervals must be visibly identified as such.","unit": "independently trained dyad; average within receiver role, then equally across roles, then across dyads","zeroVarianceRule": "Flag zero-variance/degenerate intervals; never use zero width to license a positive finding."},"fidelity": {"ledgerMessageContrast": "ledger-consistent versus ledger-shuffled target-action probability, descriptive; report whether cohort B agrees, disagrees, or is imprecise; never merge cohorts selectively","measure": "mean squared distance of native to exact replay probabilities","note": "A native predictor can occasionally beat exact replay on realized sampled Brier by chance; it cannot add information beyond complete policy state in expectation."},"independentReduction": {"environment": "uv-managed statistics environment with pinned requirements.txt; separate self-contained paper-repo environment for paper figures","forbidden": ["importing the TypeScript scorer or its result fields", "averaging disagreeing implementations", "silently loosening tolerances"],"implementation": "independent Python/scipy reduction from canonical per-case/per-dyad inputs","recomputes": ["Brier", "role reductions", "dyad reductions", "intervals", "counts", "key contrast summaries"],"tolerances": {"derivedScoresAndIntervals": 1e-8,"exactFields": ["IDs", "counts", "hashes"],"probabilities": 1e-10}},"invaliditySensitivity": "Report valid-only inference plus descriptive worst-admissible-value bounds across every attempted dyad; do not claim missingness is ignorable.","nativePredictor": {"forbidden": ["post-cutoff ledger events", "test interpretation records", "policy readout substitution", "test outcomes", "action PRNG"],"informationNote": "The native readout may contain learner information absent from ordinary records; state this information advantage in every comparison.","missingToken": "uniform distribution and reported coverage","selection": "Latest verified ledger sequence before cutoff for receiver and token","source": "authenticated training-only hypothesis.created, hypothesis.revised, or hypothesis.contradicted ledger event","value": "associationOverTypeCodes normalized over the current four candidates after adding 1e-12 to each nonnegative weight"},"ordinaryRecordWindow": {"deliveryFactScope": "Delivery/action facts observed via intention.recorded + outcome agreement are the ordinary record's own fields, not forbidden ledger content.","deliveredTokenInventoryRef": "study.channel.deliveredTokenInventory","emptyFoldRule": "Empty folds fail closed; no silent drop.","forbidden": ["ledger events", "policy bytes", "hidden state", "action PRNG", "future test data", "true test target"],"majorityReconciliation": "The validation-majority baseline follows the same rule: fit and selection on declared folds, final refit on all permitted training plus validation observations.","refit": "chosen model refits using training, validation-fit and validation-selection records before test prediction; prove the committed fit equals that refit","selection": "lowest realized multiclass Brier on validation-selection; tie tolerance 1e-12 and predictor list order; never select on test data; never omit softmax for convenience","trainingCasesPerReceiverRole": 1500,"validationFitCasesPerReceiverRole": 120,"validationSelectionCasesPerReceiverRole": 120},"overheadBenchmark": {"capCpuHours": 0.1,"counts": "explicit operation/byte counts; first 1000 canonical training events from the first eligible A dyad in manifest order","forbidden": ["claiming a new trained-agent causal effect", "claiming an independent sampling experiment", "claiming a hostile-process security guarantee"],"keys": "fresh temporary outputs and non-study in-memory signing keys; sealed originals preserved","measure": "limited record/query/audit overhead on the measured host; report raw repeats, median, range","paths": "one warmup and three measured replays through ordinary append-only and authenticated recording paths with identical numerical content and order; simulated anchoring only","trackedIn": "this protocol (binding); run at most three timed whole-bundle verifications of that dyad and 500 fixed native-query versus exact-policy-forward calls"},"predictionTarget": "receiver actual selected candidate position","predictors": [{"fit": "Candidate count","id": "uniform","role": "descriptive-reference","selectionEligible": true}, {"fit": "Laplace-smoothed actual action positions; fit and selection use their declared folds and final refit uses all permitted training plus validation observations","id": "validation-majority","role": "ordinary-record","selectionEligible": true}, {"fit": "Laplace-smoothed actual action positions conditional on delivered token only","id": "transcript-only","role": "ordinary-record","selectionEligible": true}, {"fit": "Laplace-smoothed token/type counts using ordinary records","id": "task-history","role": "ordinary-record","selectionEligible": true}, {"coefficientCount": 565,"features": "bias, token one-hot, candidate type one-hot, position one-hot, token/type interaction","fit": "2000 full-batch gradient steps, learning rate 0.05, L2 penalty 0.01 excluding bias, zero initialization","id": "ordinary-record-softmax","role": "ordinary-record","selectionEligible": true}, {"fit": "latest authenticated receiver token association strictly before training cutoff, per the nativePredictor block","id": "native-ledger","role": "primary-under-test","selectionEligible": false}, {"fit": "frozen recurrent receiver forward pass with checkpoint hidden state, delivered token, candidate observation and temperature 1; no state advance","id": "exact-policy-replay","role": "mandatory-primary-reference","selectionEligible": false}, {"fit": "identical numerical payload and update schedule as the native ledger; predictions must match native exactly, isolating authentication overhead and detection","id": "equal-content-unsigned-log","role": "descriptive-information-match","selectionEligible": false}, {"fit": "same 32-by-16 association representation at fixed training checkpoints every 64 episodes and at the final cutoff, using the same frozen projection function for both roles; report actual bytes and queries","id": "fixed-cadence-policy-summary","role": "descriptive-richer-record","selectionEligible": false}, {"fit": "one-hot actual action after outcome","id": "outcome-reading-oracle","role": "diagnostic-only","selectionEligible": false}],"researchFinding": false,"scientificDisposition": "not-tested","score": {"expectedExcessReplayFormula": "sum over ordered candidates of (nativeProbability - exactReplayProbability)^2","formula": "sum over ordered candidates of (probability - one-hot actual action)^2","name": "multiclass-brier/v1"},"status": "frozen","studyId": "ALA-LV","studyProtocol": "protocols/ala-lv-study.v1.json"}